{
  "schema_version": 1,
  "release_id": "omnira-2.4.0",
  "platform_version": "2.4.0",
  "channel": "stable",
  "source": {
    "repository": "keslleykledston/20-OMNIRA",
    "commit_sha": "4f6b5c1e2a9d8f3b7c0a1e4d9f2b6c8a0e1d3f5b",
    "workflow_run_id": "123456789"
  },
  "artifacts": [
    {
      "unit": "omnira-api",
      "image": "ghcr.io/keslleykledston/omnira-api@sha256:1111111111111111111111111111111111111111111111111111111111111111"
    },
    {
      "unit": "omnira-worker",
      "image": "ghcr.io/keslleykledston/omnira-worker@sha256:2222222222222222222222222222222222222222222222222222222222222222"
    },
    {
      "unit": "omnira-web",
      "image": "ghcr.io/keslleykledston/omnira-web@sha256:3333333333333333333333333333333333333333333333333333333333333333"
    }
  ],
  "modules_changed": [
    "platform_release"
  ],
  "compatibility": {
    "from_versions": [
      "2.3.x"
    ],
    "min_agent_protocol": 1,
    "database_strategy": "expand_then_contract_later"
  },
  "migrations": {
    "start_after": "000168",
    "target": "000172",
    "checksum_bundle": "sha256:4444444444444444444444444444444444444444444444444444444444444444"
  },
  "rollout": {
    "workloads": [
      "omnira-api",
      "omnira-worker",
      "omnira-web"
    ],
    "preflight_policy": "strict",
    "recovery_class": "R1"
  },
  "approved_by": "release-policy-stable-v1"
}
